{
  "mode": "ship",
  "meta": {
    "title": "WS v6 milestone 2",
    "subtitle": "The Rust daemon `wsd` replaces the zsh `ws` on one machine. Loop run `loop-ws-v6-local-2026-10-16-210924`, merge gate of milestone 2.",
    "date": "2026-10-18",
    "planId": "loop-ws-v6-local-2026-10-16-210924",
    "milestone": 2,
    "links": [
      { "label": "PR #15", "url": "https://github.com/rstagi/dotfile/pull/15" },
      { "label": "Final review", "url": "https://github.com/rstagi/dotfile/pull/15#pullrequestreview-5559931758" }
    ]
  },
  "summary": "`ws` runs on a Rust daemon (`wsd`) instead of zsh scripts and lock files. The daemon owns sessions, logs, messages, dependency edges, triggers and a local MCP server. It runs Loop runners as ws sessions. Command names, flags, output and exit codes stay the same. `ws backend zsh` is the way back. 35 work phases and 1 review phase. 186 files, +33858/-749. The ws shell suite: 1013 tests passed.",
  "changes": [
    { "area": "One binary", "how": "One `ws` binary: CLI, `ws daemon`, `ws mcp`. Cargo workspace `wsd/`, 3 crates.", "why": "One process owns all state. No shell lock files. Later milestones (telemetry, hub, sync) extend it." },
    { "area": "Storage", "how": "Append-only, hash-chained log per session. The SQLite registry is a projection that can be rebuilt from the logs.", "why": "The log is the source of truth: replay, audit, later sync between machines. The registry is a disposable index." },
    { "area": "IDs", "how": "ULID per session plus the `#N` alias.", "why": "ULIDs are unique across devices (v6 sync). Aliases keep the user commands." },
    { "area": "Sessions", "how": "Typed lifecycle state machine, tmux driver, headless supervisor with process groups. A daemon restart re-adopts running children.", "why": "Sessions survive a closed terminal and a daemon restart. A stop waits for the real exit." },
    { "area": "Agent launch", "how": "One `prepare` function builds argv, environment and hook files for every Claude, Codex or Grok launch. Loop runners use it through `ws agent prepare`.", "why": "Hooks, MCP and milestone 3 telemetry come from one place." },
    { "area": "Messages", "how": "Log events: sent, delivered, read. Delivery at the agent Stop hook, or by paste when idle, with retries and acknowledgement. A message to a finished session reopens it.", "why": "Confirmed delivery. The order survives a crash. Replaces the file inbox." },
    { "area": "Coordination", "how": "Dependency edges, `ws done`, `ws wait`, `ws on … done --spawn/--send-to` triggers as edge actions in the log.", "why": "Event-driven waits. No lock files." },
    { "area": "MCP", "how": "Local stdio server, 12 tools (`session_*`, `wait`, `loop_*`, `phase_spawn`). Added to each agent launch through flags. Caller identity from `WS_SESSION_ID`. Spawn limits (children, depth).", "why": "Agents drive ws directly. No edits to Claude or Codex config files. The caller cannot be faked." },
    { "area": "Loop", "how": "Runners run as ws headless sessions when wsd answers. Otherwise they launch directly. `ws top`, `ws loop start/stop`. Review worktrees belong to a session and are removed after it.", "why": "Loop runs are visible and controllable in ws. The picker shows no review worktrees." },
    { "area": "Picker", "how": "The fzf picker and tmux bindings read data from Rust commands.", "why": "The picker matches the registry." },
    { "area": "Install", "how": "`./install.sh ws` builds `~/.ws/bin/ws-rs` and installs LaunchAgent `com.rstagi.wsd` with KeepAlive.", "why": "The daemon always runs. launchd restarts it after a crash." },
    { "area": "Cutover", "how": "Backend file `~/.ws/backend` (rust or zsh). Both backends share the alias lock. Import of zsh state. `ws backend zsh` returns to zsh.", "why": "Live state migrates with a safe rollback. Phase 54 removes the zsh code in milestone 3." },
    { "area": "Parity", "how": "Golden tests from the zsh suite, written before each port.", "why": "Habits, scripts and the ws-sessions skill keep working." },
    { "area": "Process", "how": "One lane, TDD, sandboxed tests (temporary HOME, private tmux sockets), max-tier review.", "why": "Parallel lanes conflict on `Cargo.lock`. Sandboxes protect live state." }
  ],
  "delivered": [
    { "phase": 69, "criterion": "Stale-socket tests are not flaky, two daemons cannot both replace the socket, and CLAUDE.md names the Rust and spike checks (milestone 1 findings F1, F2, F4).", "result": "Socket flock and a shared daemon fixture, a stale-socket helper child, CLAUDE.md Rust and spike commands.", "status": "met" },
    { "phase": 10, "criterion": "Log entries carry the v6 §3 fields in a hash chain with fsync, no `seq` gaps, tamper detection and a reported truncated last line. `ws init` writes the device identity.", "result": "Append-only hash-chained session log, device identity, `ws init`.", "status": "met" },
    { "phase": 11, "criterion": "A SQLite projection of the logs that `rebuild` regenerates, `#N` aliases from a floor, and a resolver for alias, name or ULID prefix.", "result": "SQLite registry projection, rebuild from logs, aliases and resolver.", "status": "met" },
    { "phase": 12, "criterion": "Typed session states with errors for illegal transitions, a lifecycle API, a `session.<state>` event per transition and the caller recorded per call.", "result": "Typed lifecycle transitions and a session lifecycle API with caller audit.", "status": "met" },
    { "phase": 13, "criterion": "A tmux driver for sessions, windows, panes, `@ws_*` options, bracketed paste, capture and pane death, tested on a sandbox server.", "result": "tmux driver and O_CLOFORK lock files (an L3 fix for inherited flock descriptors).", "status": "met" },
    { "phase": 14, "criterion": "`ws whoami`, `ws name`, `ws sessions` and `ws show` match the zsh output (ids as `#N`) and accept `--json`.", "result": "Ported with `--json` and zsh golden fixtures, plus a rename API.", "status": "met" },
    { "phase": 15, "criterion": "`ws new`, `ws add` and `ws list` work from the registry and never scan `$WS_ROOT/*/*`.", "result": "`ws new/add/list` on the registry with no `WS_ROOT` scan, repo setup, conductor includes and the tmux session.", "status": "met" },
    { "phase": 16, "criterion": "`ws rm`, `ws open`, `ws pin` and bare `ws` match zsh. `ws rm` refuses a dirty worktree. Pins persist.", "result": "`ws rm/open/pin/attach` on the registry, dirty-worktree refusal, persisted pins, golden tests.", "status": "met" },
    { "phase": 17, "criterion": "`ws merge` and its popup match zsh, and the `merge.test.sh` scenarios pass as Rust tests.", "result": "Ported, with the merge scenarios as Rust integration tests (fake gh, bare origin).", "status": "met" },
    { "phase": 18, "criterion": "One preparation contract builds every agent launch, and `ws claude|codex|grok` start agents in tmux windows with hook settings.", "result": "Shared `prepare()` contract, tracked launches with hook settings, slots and resume.", "status": "met" },
    { "phase": 19, "criterion": "`ws hook` keeps the seq/turn order, appends turn, tool and agent events, spools when the daemon is down, and keeps p95 under 50 ms on the full ingest path.", "result": "Ordered seq/turn, turn, tool and agent events in the session log, spool and replay, bounded tmux lookup, p95 under 50 ms.", "status": "met" },
    { "phase": 20, "criterion": "terminal-notifier, osascript and boringnotch fire on the same hook states with the same text. `WS_NOTIFY=0` turns them off.", "result": "Notification adapters on hook states, `WS_NOTIFY=0`, `_dismiss`, `_build-notifier`.", "status": "met" },
    { "phase": 21, "criterion": "`ws session create --headless` runs a command in its own process group with the given cwd, environment and I/O files.", "result": "Headless session supervisor and I/O contract. Notification tests wait for events. The p95 assertion became opt-in (20/20 Verify).", "status": "met" },
    { "phase": 67, "criterion": "`phase.spawn` creates a headless child, stops it at `max_runtime`, and the daemon re-adopts a running child after a restart.", "result": "`phase.spawn` API, durable pid and process group, restart adoption, `max_runtime` TERM then KILL.", "status": "met" },
    { "phase": 57, "criterion": "A stop sends SIGTERM to the process group, SIGKILL after a grace period, and returns only when the group is gone. `ws session run` waits in the foreground.", "result": "Headless stop waits for the process-group exit (TERM, 10 s grace, KILL). `ws session run` runs in the foreground.", "status": "met" },
    { "phase": 58, "criterion": "`ws agent prepare --mode headless` prints the contract output, and `ws hook` accepts events with no tmux pane.", "result": "`ws agent prepare --mode headless` (json or sh), pane-less hooks keyed by `WS_SESSION_ID` with a durable seq/turn order.", "status": "met" },
    { "phase": 22, "criterion": "`ws send` appends `message.sent`, the inbox is a projection, and `ws inbox` and `ws ack` work.", "result": "`message.sent` and `message.read` log events, a human session, an ordered inbox projection, `ws send/inbox/ack`.", "status": "met" },
    { "phase": 23, "criterion": "The Stop hook reply blocks with the undelivered batch, and each delivery and implicit read is a log event.", "result": "Stop-hook batch delivery, `message.delivered` after the stdout confirm, implicit read, spool replay dedup, local-device-only injection.", "status": "met" },
    { "phase": 24, "criterion": "Idle windows get a bracketed paste, acknowledged by the next prompt, with a requeue on timeout from an in-daemon retry worker.", "result": "Idle paste delivery, `UserPromptSubmit` receipt, retry worker with an acknowledgement timeout, crash-durable batches.", "status": "met" },